
         /\      Grafana   /‾‾/  
    /\  /  \     |\  __   /  /   
   /  \/    \    | |/ /  /   ‾‾\ 
  /          \   |   (  |  (‾)  |
 / __________ \  |_|\_\  \_____/ 


     execution: local
        script: /scripts/k6_steady_5m_20vus.js
        output: -

     scenarios: (100.00%) 1 scenario, 20 max VUs, 5m30s max duration (incl. graceful stop):
              * default: 20 looping VUs for 5m0s (gracefulStop: 30s)


running (0m01.0s), 20/20 VUs, 0 complete and 0 interrupted iterations
default   [   0% ] 20 VUs  0m01.0s/5m0s

running (0m02.0s), 20/20 VUs, 0 complete and 0 interrupted iterations
default   [   1% ] 20 VUs  0m02.0s/5m0s

running (0m03.0s), 20/20 VUs, 0 complete and 0 interrupted iterations
default   [   1% ] 20 VUs  0m03.0s/5m0s

running (0m04.0s), 20/20 VUs, 0 complete and 0 interrupted iterations
default   [   1% ] 20 VUs  0m04.0s/5m0s

running (0m05.0s), 20/20 VUs, 1 complete and 0 interrupted iterations
default   [   2% ] 20 VUs  0m05.0s/5m0s

running (0m06.0s), 20/20 VUs, 1 complete and 0 interrupted iterations
default   [   2% ] 20 VUs  0m06.0s/5m0s

running (0m07.0s), 20/20 VUs, 1 complete and 0 interrupted iterations
default   [   2% ] 20 VUs  0m07.0s/5m0s

running (0m08.0s), 20/20 VUs, 1 complete and 0 interrupted iterations
default   [   3% ] 20 VUs  0m08.0s/5m0s

running (0m09.0s), 20/20 VUs, 1 complete and 0 interrupted iterations
default   [   3% ] 20 VUs  0m09.0s/5m0s

running (0m10.0s), 20/20 VUs, 1 complete and 0 interrupted iterations
default   [   3% ] 20 VUs  0m10.0s/5m0s

running (0m11.0s), 20/20 VUs, 1 complete and 0 interrupted iterations
default   [   4% ] 20 VUs  0m11.0s/5m0s

running (0m12.0s), 20/20 VUs, 2 complete and 0 interrupted iterations
default   [   4% ] 20 VUs  0m12.0s/5m0s

running (0m13.0s), 20/20 VUs, 5 complete and 0 interrupted iterations
default   [   4% ] 20 VUs  0m13.0s/5m0s

running (0m14.0s), 20/20 VUs, 6 complete and 0 interrupted iterations
default   [   5% ] 20 VUs  0m14.0s/5m0s

running (0m15.0s), 20/20 VUs, 6 complete and 0 interrupted iterations
default   [   5% ] 20 VUs  0m15.0s/5m0s

running (0m16.0s), 20/20 VUs, 6 complete and 0 interrupted iterations
default   [   5% ] 20 VUs  0m16.0s/5m0s

running (0m17.0s), 20/20 VUs, 6 complete and 0 interrupted iterations
default   [   6% ] 20 VUs  0m17.0s/5m0s

running (0m18.0s), 20/20 VUs, 6 complete and 0 interrupted iterations
default   [   6% ] 20 VUs  0m18.0s/5m0s

running (0m19.0s), 20/20 VUs, 6 complete and 0 interrupted iterations
default   [   6% ] 20 VUs  0m19.0s/5m0s

running (0m20.0s), 20/20 VUs, 6 complete and 0 interrupted iterations
default   [   7% ] 20 VUs  0m20.0s/5m0s

running (0m21.0s), 20/20 VUs, 6 complete and 0 interrupted iterations
default   [   7% ] 20 VUs  0m21.0s/5m0s

running (0m22.0s), 20/20 VUs, 6 complete and 0 interrupted iterations
default   [   7% ] 20 VUs  0m22.0s/5m0s

running (0m23.0s), 20/20 VUs, 6 complete and 0 interrupted iterations
default   [   8% ] 20 VUs  0m23.0s/5m0s

running (0m24.0s), 20/20 VUs, 6 complete and 0 interrupted iterations
default   [   8% ] 20 VUs  0m24.0s/5m0s

running (0m25.0s), 20/20 VUs, 6 complete and 0 interrupted iterations
default   [   8% ] 20 VUs  0m25.0s/5m0s

running (0m26.0s), 20/20 VUs, 6 complete and 0 interrupted iterations
default   [   9% ] 20 VUs  0m26.0s/5m0s

running (0m27.0s), 20/20 VUs, 6 complete and 0 interrupted iterations
default   [   9% ] 20 VUs  0m27.0s/5m0s

running (0m28.0s), 20/20 VUs, 6 complete and 0 interrupted iterations
default   [   9% ] 20 VUs  0m28.0s/5m0s

running (0m29.0s), 20/20 VUs, 6 complete and 0 interrupted iterations
default   [  10% ] 20 VUs  0m29.0s/5m0s

running (0m30.0s), 20/20 VUs, 6 complete and 0 interrupted iterations
default   [  10% ] 20 VUs  0m30.0s/5m0s

running (0m31.0s), 20/20 VUs, 6 complete and 0 interrupted iterations
default   [  10% ] 20 VUs  0m31.0s/5m0s

running (0m32.0s), 20/20 VUs, 6 complete and 0 interrupted iterations
default   [  11% ] 20 VUs  0m32.0s/5m0s

running (0m33.0s), 20/20 VUs, 6 complete and 0 interrupted iterations
default   [  11% ] 20 VUs  0m33.0s/5m0s

running (0m34.0s), 20/20 VUs, 6 complete and 0 interrupted iterations
default   [  11% ] 20 VUs  0m34.0s/5m0s

running (0m35.0s), 20/20 VUs, 6 complete and 0 interrupted iterations
default   [  12% ] 20 VUs  0m35.0s/5m0s

running (0m36.0s), 20/20 VUs, 7 complete and 0 interrupted iterations
default   [  12% ] 20 VUs  0m36.0s/5m0s

running (0m37.0s), 20/20 VUs, 7 complete and 0 interrupted iterations
default   [  12% ] 20 VUs  0m37.0s/5m0s

running (0m38.0s), 20/20 VUs, 7 complete and 0 interrupted iterations
default   [  13% ] 20 VUs  0m38.0s/5m0s

running (0m39.0s), 20/20 VUs, 7 complete and 0 interrupted iterations
default   [  13% ] 20 VUs  0m39.0s/5m0s

running (0m40.0s), 20/20 VUs, 7 complete and 0 interrupted iterations
default   [  13% ] 20 VUs  0m40.0s/5m0s

running (0m41.0s), 20/20 VUs, 7 complete and 0 interrupted iterations
default   [  14% ] 20 VUs  0m41.0s/5m0s

running (0m42.0s), 20/20 VUs, 7 complete and 0 interrupted iterations
default   [  14% ] 20 VUs  0m42.0s/5m0s

running (0m43.0s), 20/20 VUs, 10 complete and 0 interrupted iterations
default   [  14% ] 20 VUs  0m43.0s/5m0s

running (0m44.0s), 20/20 VUs, 12 complete and 0 interrupted iterations
default   [  15% ] 20 VUs  0m44.0s/5m0s

running (0m45.0s), 20/20 VUs, 14 complete and 0 interrupted iterations
default   [  15% ] 20 VUs  0m45.0s/5m0s

running (0m46.0s), 20/20 VUs, 15 complete and 0 interrupted iterations
default   [  15% ] 20 VUs  0m46.0s/5m0s

running (0m47.0s), 20/20 VUs, 16 complete and 0 interrupted iterations
default   [  16% ] 20 VUs  0m47.0s/5m0s

running (0m48.0s), 20/20 VUs, 21 complete and 0 interrupted iterations
default   [  16% ] 20 VUs  0m48.0s/5m0s

running (0m49.0s), 20/20 VUs, 21 complete and 0 interrupted iterations
default   [  16% ] 20 VUs  0m49.0s/5m0s

running (0m50.0s), 20/20 VUs, 25 complete and 0 interrupted iterations
default   [  17% ] 20 VUs  0m50.0s/5m0s

running (0m51.0s), 20/20 VUs, 27 complete and 0 interrupted iterations
default   [  17% ] 20 VUs  0m51.0s/5m0s

running (0m52.0s), 20/20 VUs, 28 complete and 0 interrupted iterations
default   [  17% ] 20 VUs  0m52.0s/5m0s

running (0m53.0s), 20/20 VUs, 30 complete and 0 interrupted iterations
default   [  18% ] 20 VUs  0m53.0s/5m0s

running (0m54.0s), 20/20 VUs, 31 complete and 0 interrupted iterations
default   [  18% ] 20 VUs  0m54.0s/5m0s

running (0m55.0s), 20/20 VUs, 35 complete and 0 interrupted iterations
default   [  18% ] 20 VUs  0m55.0s/5m0s

running (0m56.0s), 20/20 VUs, 37 complete and 0 interrupted iterations
default   [  19% ] 20 VUs  0m56.0s/5m0s

running (0m57.0s), 20/20 VUs, 38 complete and 0 interrupted iterations
default   [  19% ] 20 VUs  0m57.0s/5m0s

running (0m58.0s), 20/20 VUs, 38 complete and 0 interrupted iterations
default   [  19% ] 20 VUs  0m58.0s/5m0s

running (0m59.0s), 20/20 VUs, 39 complete and 0 interrupted iterations
default   [  20% ] 20 VUs  0m59.0s/5m0s

running (1m00.0s), 20/20 VUs, 39 complete and 0 interrupted iterations
default   [  20% ] 20 VUs  1m00.0s/5m0s

running (1m01.0s), 20/20 VUs, 40 complete and 0 interrupted iterations
default   [  20% ] 20 VUs  1m01.0s/5m0s

running (1m02.0s), 20/20 VUs, 41 complete and 0 interrupted iterations
default   [  21% ] 20 VUs  1m02.0s/5m0s

running (1m03.0s), 20/20 VUs, 41 complete and 0 interrupted iterations
default   [  21% ] 20 VUs  1m03.0s/5m0s

running (1m04.0s), 20/20 VUs, 41 complete and 0 interrupted iterations
default   [  21% ] 20 VUs  1m04.0s/5m0s

running (1m05.0s), 20/20 VUs, 41 complete and 0 interrupted iterations
default   [  22% ] 20 VUs  1m05.0s/5m0s

running (1m06.0s), 20/20 VUs, 41 complete and 0 interrupted iterations
default   [  22% ] 20 VUs  1m06.0s/5m0s

running (1m07.0s), 20/20 VUs, 41 complete and 0 interrupted iterations
default   [  22% ] 20 VUs  1m07.0s/5m0s

running (1m08.0s), 20/20 VUs, 41 complete and 0 interrupted iterations
default   [  23% ] 20 VUs  1m08.0s/5m0s

running (1m09.0s), 20/20 VUs, 41 complete and 0 interrupted iterations
default   [  23% ] 20 VUs  1m09.0s/5m0s

running (1m10.0s), 20/20 VUs, 41 complete and 0 interrupted iterations
default   [  23% ] 20 VUs  1m10.0s/5m0s

running (1m11.0s), 20/20 VUs, 41 complete and 0 interrupted iterations
default   [  24% ] 20 VUs  1m11.0s/5m0s

running (1m12.0s), 20/20 VUs, 41 complete and 0 interrupted iterations
default   [  24% ] 20 VUs  1m12.0s/5m0s

running (1m13.0s), 20/20 VUs, 41 complete and 0 interrupted iterations
default   [  24% ] 20 VUs  1m13.0s/5m0s

running (1m14.0s), 20/20 VUs, 41 complete and 0 interrupted iterations
default   [  25% ] 20 VUs  1m14.0s/5m0s

running (1m15.0s), 20/20 VUs, 41 complete and 0 interrupted iterations
default   [  25% ] 20 VUs  1m15.0s/5m0s

running (1m16.0s), 20/20 VUs, 41 complete and 0 interrupted iterations
default   [  25% ] 20 VUs  1m16.0s/5m0s

running (1m17.0s), 20/20 VUs, 41 complete and 0 interrupted iterations
default   [  26% ] 20 VUs  1m17.0s/5m0s

running (1m18.0s), 20/20 VUs, 41 complete and 0 interrupted iterations
default   [  26% ] 20 VUs  1m18.0s/5m0s

running (1m19.0s), 20/20 VUs, 41 complete and 0 interrupted iterations
default   [  26% ] 20 VUs  1m19.0s/5m0s

running (1m20.0s), 20/20 VUs, 41 complete and 0 interrupted iterations
default   [  27% ] 20 VUs  1m20.0s/5m0s

running (1m21.0s), 20/20 VUs, 41 complete and 0 interrupted iterations
default   [  27% ] 20 VUs  1m21.0s/5m0s

running (1m22.0s), 20/20 VUs, 41 complete and 0 interrupted iterations
default   [  27% ] 20 VUs  1m22.0s/5m0s

running (1m23.0s), 20/20 VUs, 41 complete and 0 interrupted iterations
default   [  28% ] 20 VUs  1m23.0s/5m0s

running (1m24.0s), 20/20 VUs, 41 complete and 0 interrupted iterations
default   [  28% ] 20 VUs  1m24.0s/5m0s

running (1m25.0s), 20/20 VUs, 41 complete and 0 interrupted iterations
default   [  28% ] 20 VUs  1m25.0s/5m0s

running (1m26.0s), 20/20 VUs, 41 complete and 0 interrupted iterations
default   [  29% ] 20 VUs  1m26.0s/5m0s

running (1m27.0s), 20/20 VUs, 43 complete and 0 interrupted iterations
default   [  29% ] 20 VUs  1m27.0s/5m0s

running (1m28.0s), 20/20 VUs, 43 complete and 0 interrupted iterations
default   [  29% ] 20 VUs  1m28.0s/5m0s

running (1m29.0s), 20/20 VUs, 44 complete and 0 interrupted iterations
default   [  30% ] 20 VUs  1m29.0s/5m0s

running (1m30.0s), 20/20 VUs, 44 complete and 0 interrupted iterations
default   [  30% ] 20 VUs  1m30.0s/5m0s

running (1m31.0s), 20/20 VUs, 45 complete and 0 interrupted iterations
default   [  30% ] 20 VUs  1m31.0s/5m0s

running (1m32.0s), 20/20 VUs, 48 complete and 0 interrupted iterations
default   [  31% ] 20 VUs  1m32.0s/5m0s

running (1m33.0s), 20/20 VUs, 50 complete and 0 interrupted iterations
default   [  31% ] 20 VUs  1m33.0s/5m0s

running (1m34.0s), 20/20 VUs, 50 complete and 0 interrupted iterations
default   [  31% ] 20 VUs  1m34.0s/5m0s

running (1m35.0s), 20/20 VUs, 52 complete and 0 interrupted iterations
default   [  32% ] 20 VUs  1m35.0s/5m0s

running (1m36.0s), 20/20 VUs, 54 complete and 0 interrupted iterations
default   [  32% ] 20 VUs  1m36.0s/5m0s

running (1m37.0s), 20/20 VUs, 56 complete and 0 interrupted iterations
default   [  32% ] 20 VUs  1m37.0s/5m0s

running (1m38.0s), 20/20 VUs, 59 complete and 0 interrupted iterations
default   [  33% ] 20 VUs  1m38.0s/5m0s

running (1m39.0s), 20/20 VUs, 61 complete and 0 interrupted iterations
default   [  33% ] 20 VUs  1m39.0s/5m0s

running (1m40.0s), 20/20 VUs, 63 complete and 0 interrupted iterations
default   [  33% ] 20 VUs  1m40.0s/5m0s

running (1m41.0s), 20/20 VUs, 64 complete and 0 interrupted iterations
default   [  34% ] 20 VUs  1m41.0s/5m0s

running (1m42.0s), 20/20 VUs, 68 complete and 0 interrupted iterations
default   [  34% ] 20 VUs  1m42.0s/5m0s

running (1m43.0s), 20/20 VUs, 70 complete and 0 interrupted iterations
default   [  34% ] 20 VUs  1m43.0s/5m0s

running (1m44.0s), 20/20 VUs, 71 complete and 0 interrupted iterations
default   [  35% ] 20 VUs  1m44.0s/5m0s

running (1m45.0s), 20/20 VUs, 73 complete and 0 interrupted iterations
default   [  35% ] 20 VUs  1m45.0s/5m0s

running (1m46.0s), 20/20 VUs, 75 complete and 0 interrupted iterations
default   [  35% ] 20 VUs  1m46.0s/5m0s

running (1m47.0s), 20/20 VUs, 77 complete and 0 interrupted iterations
default   [  36% ] 20 VUs  1m47.0s/5m0s

running (1m48.0s), 20/20 VUs, 78 complete and 0 interrupted iterations
default   [  36% ] 20 VUs  1m48.0s/5m0s

running (1m49.0s), 20/20 VUs, 78 complete and 0 interrupted iterations
default   [  36% ] 20 VUs  1m49.0s/5m0s

running (1m50.0s), 20/20 VUs, 78 complete and 0 interrupted iterations
default   [  37% ] 20 VUs  1m50.0s/5m0s

running (1m51.0s), 20/20 VUs, 80 complete and 0 interrupted iterations
default   [  37% ] 20 VUs  1m51.0s/5m0s

running (1m52.0s), 20/20 VUs, 80 complete and 0 interrupted iterations
default   [  37% ] 20 VUs  1m52.0s/5m0s

running (1m53.0s), 20/20 VUs, 80 complete and 0 interrupted iterations
default   [  38% ] 20 VUs  1m53.0s/5m0s

running (1m54.0s), 20/20 VUs, 80 complete and 0 interrupted iterations
default   [  38% ] 20 VUs  1m54.0s/5m0s

running (1m55.0s), 20/20 VUs, 80 complete and 0 interrupted iterations
default   [  38% ] 20 VUs  1m55.0s/5m0s

running (1m56.0s), 20/20 VUs, 80 complete and 0 interrupted iterations
default   [  39% ] 20 VUs  1m56.0s/5m0s

running (1m57.0s), 20/20 VUs, 80 complete and 0 interrupted iterations
default   [  39% ] 20 VUs  1m57.0s/5m0s

running (1m58.0s), 20/20 VUs, 80 complete and 0 interrupted iterations
default   [  39% ] 20 VUs  1m58.0s/5m0s

running (1m59.0s), 20/20 VUs, 80 complete and 0 interrupted iterations
default   [  40% ] 20 VUs  1m59.0s/5m0s

running (2m00.0s), 20/20 VUs, 80 complete and 0 interrupted iterations
default   [  40% ] 20 VUs  2m00.0s/5m0s

running (2m01.0s), 20/20 VUs, 80 complete and 0 interrupted iterations
default   [  40% ] 20 VUs  2m01.0s/5m0s

running (2m02.0s), 20/20 VUs, 80 complete and 0 interrupted iterations
default   [  41% ] 20 VUs  2m02.0s/5m0s

running (2m03.0s), 20/20 VUs, 80 complete and 0 interrupted iterations
default   [  41% ] 20 VUs  2m03.0s/5m0s

running (2m04.0s), 20/20 VUs, 80 complete and 0 interrupted iterations
default   [  41% ] 20 VUs  2m04.0s/5m0s

running (2m05.0s), 20/20 VUs, 80 complete and 0 interrupted iterations
default   [  42% ] 20 VUs  2m05.0s/5m0s

running (2m06.0s), 20/20 VUs, 80 complete and 0 interrupted iterations
default   [  42% ] 20 VUs  2m06.0s/5m0s

running (2m07.0s), 20/20 VUs, 80 complete and 0 interrupted iterations
default   [  42% ] 20 VUs  2m07.0s/5m0s

running (2m08.0s), 20/20 VUs, 80 complete and 0 interrupted iterations
default   [  43% ] 20 VUs  2m08.0s/5m0s

running (2m09.0s), 20/20 VUs, 80 complete and 0 interrupted iterations
default   [  43% ] 20 VUs  2m09.0s/5m0s

running (2m10.0s), 20/20 VUs, 80 complete and 0 interrupted iterations
default   [  43% ] 20 VUs  2m10.0s/5m0s

running (2m11.0s), 20/20 VUs, 80 complete and 0 interrupted iterations
default   [  44% ] 20 VUs  2m11.0s/5m0s

running (2m12.0s), 20/20 VUs, 80 complete and 0 interrupted iterations
default   [  44% ] 20 VUs  2m12.0s/5m0s

running (2m13.0s), 20/20 VUs, 80 complete and 0 interrupted iterations
default   [  44% ] 20 VUs  2m13.0s/5m0s

running (2m14.0s), 20/20 VUs, 80 complete and 0 interrupted iterations
default   [  45% ] 20 VUs  2m14.0s/5m0s

running (2m15.0s), 20/20 VUs, 80 complete and 0 interrupted iterations
default   [  45% ] 20 VUs  2m15.0s/5m0s

running (2m16.0s), 20/20 VUs, 80 complete and 0 interrupted iterations
default   [  45% ] 20 VUs  2m16.0s/5m0s

running (2m17.0s), 20/20 VUs, 81 complete and 0 interrupted iterations
default   [  46% ] 20 VUs  2m17.0s/5m0s

running (2m18.0s), 20/20 VUs, 82 complete and 0 interrupted iterations
default   [  46% ] 20 VUs  2m18.0s/5m0s

running (2m19.0s), 20/20 VUs, 83 complete and 0 interrupted iterations
default   [  46% ] 20 VUs  2m19.0s/5m0s

running (2m20.0s), 20/20 VUs, 84 complete and 0 interrupted iterations
default   [  47% ] 20 VUs  2m20.0s/5m0s

running (2m21.0s), 20/20 VUs, 89 complete and 0 interrupted iterations
default   [  47% ] 20 VUs  2m21.0s/5m0s

running (2m22.0s), 20/20 VUs, 89 complete and 0 interrupted iterations
default   [  47% ] 20 VUs  2m22.0s/5m0s

running (2m23.0s), 20/20 VUs, 92 complete and 0 interrupted iterations
default   [  48% ] 20 VUs  2m23.0s/5m0s

running (2m24.0s), 20/20 VUs, 94 complete and 0 interrupted iterations
default   [  48% ] 20 VUs  2m24.0s/5m0s

running (2m25.0s), 20/20 VUs, 95 complete and 0 interrupted iterations
default   [  48% ] 20 VUs  2m25.0s/5m0s

running (2m26.0s), 20/20 VUs, 97 complete and 0 interrupted iterations
default   [  49% ] 20 VUs  2m26.0s/5m0s

running (2m27.0s), 20/20 VUs, 98 complete and 0 interrupted iterations
default   [  49% ] 20 VUs  2m27.0s/5m0s

running (2m28.0s), 20/20 VUs, 102 complete and 0 interrupted iterations
default   [  49% ] 20 VUs  2m28.0s/5m0s

running (2m29.0s), 20/20 VUs, 102 complete and 0 interrupted iterations
default   [  50% ] 20 VUs  2m29.0s/5m0s

running (2m30.0s), 20/20 VUs, 104 complete and 0 interrupted iterations
default   [  50% ] 20 VUs  2m30.0s/5m0s

running (2m31.0s), 20/20 VUs, 105 complete and 0 interrupted iterations
default   [  50% ] 20 VUs  2m31.0s/5m0s

running (2m32.0s), 20/20 VUs, 109 complete and 0 interrupted iterations
default   [  51% ] 20 VUs  2m32.0s/5m0s

running (2m33.0s), 20/20 VUs, 112 complete and 0 interrupted iterations
default   [  51% ] 20 VUs  2m33.0s/5m0s

running (2m34.0s), 20/20 VUs, 112 complete and 0 interrupted iterations
default   [  51% ] 20 VUs  2m34.0s/5m0s

running (2m35.0s), 20/20 VUs, 114 complete and 0 interrupted iterations
default   [  52% ] 20 VUs  2m35.0s/5m0s

running (2m36.0s), 20/20 VUs, 114 complete and 0 interrupted iterations
default   [  52% ] 20 VUs  2m36.0s/5m0s

running (2m37.0s), 20/20 VUs, 118 complete and 0 interrupted iterations
default   [  52% ] 20 VUs  2m37.0s/5m0s

running (2m38.0s), 20/20 VUs, 118 complete and 0 interrupted iterations
default   [  53% ] 20 VUs  2m38.0s/5m0s

running (2m39.0s), 20/20 VUs, 119 complete and 0 interrupted iterations
default   [  53% ] 20 VUs  2m39.0s/5m0s

running (2m40.0s), 20/20 VUs, 119 complete and 0 interrupted iterations
default   [  53% ] 20 VUs  2m40.0s/5m0s

running (2m41.0s), 20/20 VUs, 119 complete and 0 interrupted iterations
default   [  54% ] 20 VUs  2m41.0s/5m0s

running (2m42.0s), 20/20 VUs, 119 complete and 0 interrupted iterations
default   [  54% ] 20 VUs  2m42.0s/5m0s

running (2m43.0s), 20/20 VUs, 119 complete and 0 interrupted iterations
default   [  54% ] 20 VUs  2m43.0s/5m0s

running (2m44.0s), 20/20 VUs, 119 complete and 0 interrupted iterations
default   [  55% ] 20 VUs  2m44.0s/5m0s

running (2m45.0s), 20/20 VUs, 119 complete and 0 interrupted iterations
default   [  55% ] 20 VUs  2m45.0s/5m0s

running (2m46.0s), 20/20 VUs, 119 complete and 0 interrupted iterations
default   [  55% ] 20 VUs  2m46.0s/5m0s

running (2m47.0s), 20/20 VUs, 119 complete and 0 interrupted iterations
default   [  56% ] 20 VUs  2m47.0s/5m0s

running (2m48.0s), 20/20 VUs, 119 complete and 0 interrupted iterations
default   [  56% ] 20 VUs  2m48.0s/5m0s

running (2m49.0s), 20/20 VUs, 119 complete and 0 interrupted iterations
default   [  56% ] 20 VUs  2m49.0s/5m0s

running (2m50.0s), 20/20 VUs, 119 complete and 0 interrupted iterations
default   [  57% ] 20 VUs  2m50.0s/5m0s
time="2026-02-26T05:33:06Z" level=warning msg="Request Failed" error="Get \"http://host.docker.internal:8000/api/resources?all=true&status=approved\": request timeout"

running (2m51.0s), 20/20 VUs, 120 complete and 0 interrupted iterations
default   [  57% ] 20 VUs  2m51.0s/5m0s

running (2m52.0s), 20/20 VUs, 120 complete and 0 interrupted iterations
default   [  57% ] 20 VUs  2m52.0s/5m0s

running (2m53.0s), 20/20 VUs, 120 complete and 0 interrupted iterations
default   [  58% ] 20 VUs  2m53.0s/5m0s

running (2m54.0s), 20/20 VUs, 120 complete and 0 interrupted iterations
default   [  58% ] 20 VUs  2m54.0s/5m0s

running (2m55.0s), 20/20 VUs, 120 complete and 0 interrupted iterations
default   [  58% ] 20 VUs  2m55.0s/5m0s

running (2m56.0s), 20/20 VUs, 120 complete and 0 interrupted iterations
default   [  59% ] 20 VUs  2m56.0s/5m0s

running (2m57.0s), 20/20 VUs, 120 complete and 0 interrupted iterations
default   [  59% ] 20 VUs  2m57.0s/5m0s

running (2m58.0s), 20/20 VUs, 120 complete and 0 interrupted iterations
default   [  59% ] 20 VUs  2m58.0s/5m0s

running (2m59.0s), 20/20 VUs, 120 complete and 0 interrupted iterations
default   [  60% ] 20 VUs  2m59.0s/5m0s

running (3m00.0s), 20/20 VUs, 120 complete and 0 interrupted iterations
default   [  60% ] 20 VUs  3m00.0s/5m0s

running (3m01.0s), 20/20 VUs, 120 complete and 0 interrupted iterations
default   [  60% ] 20 VUs  3m01.0s/5m0s

running (3m02.0s), 20/20 VUs, 120 complete and 0 interrupted iterations
default   [  61% ] 20 VUs  3m02.0s/5m0s

running (3m03.0s), 20/20 VUs, 120 complete and 0 interrupted iterations
default   [  61% ] 20 VUs  3m03.0s/5m0s

running (3m04.0s), 20/20 VUs, 120 complete and 0 interrupted iterations
default   [  61% ] 20 VUs  3m04.0s/5m0s

running (3m05.0s), 20/20 VUs, 120 complete and 0 interrupted iterations
default   [  62% ] 20 VUs  3m05.0s/5m0s

running (3m06.0s), 20/20 VUs, 120 complete and 0 interrupted iterations
default   [  62% ] 20 VUs  3m06.0s/5m0s

running (3m07.0s), 20/20 VUs, 123 complete and 0 interrupted iterations
default   [  62% ] 20 VUs  3m07.0s/5m0s

running (3m08.0s), 20/20 VUs, 124 complete and 0 interrupted iterations
default   [  63% ] 20 VUs  3m08.0s/5m0s

running (3m09.0s), 20/20 VUs, 125 complete and 0 interrupted iterations
default   [  63% ] 20 VUs  3m09.0s/5m0s

running (3m10.0s), 20/20 VUs, 125 complete and 0 interrupted iterations
default   [  63% ] 20 VUs  3m10.0s/5m0s

running (3m11.0s), 20/20 VUs, 125 complete and 0 interrupted iterations
default   [  64% ] 20 VUs  3m11.0s/5m0s

running (3m12.0s), 20/20 VUs, 125 complete and 0 interrupted iterations
default   [  64% ] 20 VUs  3m12.0s/5m0s

running (3m13.0s), 20/20 VUs, 125 complete and 0 interrupted iterations
default   [  64% ] 20 VUs  3m13.0s/5m0s

running (3m14.0s), 20/20 VUs, 125 complete and 0 interrupted iterations
default   [  65% ] 20 VUs  3m14.0s/5m0s

running (3m15.0s), 20/20 VUs, 125 complete and 0 interrupted iterations
default   [  65% ] 20 VUs  3m15.0s/5m0s

running (3m16.0s), 20/20 VUs, 125 complete and 0 interrupted iterations
default   [  65% ] 20 VUs  3m16.0s/5m0s

running (3m17.0s), 20/20 VUs, 125 complete and 0 interrupted iterations
default   [  66% ] 20 VUs  3m17.0s/5m0s

running (3m18.0s), 20/20 VUs, 125 complete and 0 interrupted iterations
default   [  66% ] 20 VUs  3m18.0s/5m0s
time="2026-02-26T05:33:34Z" level=warning msg="Request Failed" error="Get \"http://host.docker.internal:8000/api/resources?all=true&status=approved\": request timeout"

running (3m19.0s), 20/20 VUs, 126 complete and 0 interrupted iterations
default   [  66% ] 20 VUs  3m19.0s/5m0s

running (3m20.0s), 20/20 VUs, 126 complete and 0 interrupted iterations
default   [  67% ] 20 VUs  3m20.0s/5m0s
time="2026-02-26T05:33:36Z" level=warning msg="Request Failed" error="Get \"http://host.docker.internal:8000/api/resources?all=true&status=approved\": request timeout"
time="2026-02-26T05:33:36Z" level=warning msg="Request Failed" error="Get \"http://host.docker.internal:8000/api/resources?all=true&status=approved\": request timeout"

running (3m21.0s), 20/20 VUs, 129 complete and 0 interrupted iterations
default   [  67% ] 20 VUs  3m21.0s/5m0s

running (3m22.0s), 20/20 VUs, 129 complete and 0 interrupted iterations
default   [  67% ] 20 VUs  3m22.0s/5m0s
time="2026-02-26T05:33:38Z" level=warning msg="Request Failed" error="Get \"http://host.docker.internal:8000/api/resources?all=true&status=approved\": request timeout"
time="2026-02-26T05:33:38Z" level=warning msg="Request Failed" error="Get \"http://host.docker.internal:8000/api/resources?all=true&status=approved\": request timeout"

running (3m23.0s), 20/20 VUs, 134 complete and 0 interrupted iterations
default   [  68% ] 20 VUs  3m23.0s/5m0s
time="2026-02-26T05:33:39Z" level=warning msg="Request Failed" error="Get \"http://host.docker.internal:8000/api/resources?all=true&status=approved\": request timeout"

running (3m24.0s), 20/20 VUs, 136 complete and 0 interrupted iterations
default   [  68% ] 20 VUs  3m24.0s/5m0s

running (3m25.0s), 20/20 VUs, 137 complete and 0 interrupted iterations
default   [  68% ] 20 VUs  3m25.0s/5m0s
time="2026-02-26T05:33:40Z" level=warning msg="Request Failed" error="Get \"http://host.docker.internal:8000/api/resources?all=true&status=approved\": request timeout"

running (3m26.0s), 20/20 VUs, 139 complete and 0 interrupted iterations
default   [  69% ] 20 VUs  3m26.0s/5m0s

running (3m27.0s), 20/20 VUs, 139 complete and 0 interrupted iterations
default   [  69% ] 20 VUs  3m27.0s/5m0s
time="2026-02-26T05:33:43Z" level=warning msg="Request Failed" error="Get \"http://host.docker.internal:8000/api/resources?all=true&status=approved\": request timeout"

running (3m28.0s), 20/20 VUs, 141 complete and 0 interrupted iterations
default   [  69% ] 20 VUs  3m28.0s/5m0s

running (3m29.0s), 20/20 VUs, 141 complete and 0 interrupted iterations
default   [  70% ] 20 VUs  3m29.0s/5m0s

running (3m30.0s), 20/20 VUs, 143 complete and 0 interrupted iterations
default   [  70% ] 20 VUs  3m30.0s/5m0s

running (3m31.0s), 20/20 VUs, 144 complete and 0 interrupted iterations
default   [  70% ] 20 VUs  3m31.0s/5m0s
time="2026-02-26T05:33:46Z" level=warning msg="Request Failed" error="Get \"http://host.docker.internal:8000/api/resources?all=true&status=approved\": request timeout"
time="2026-02-26T05:33:47Z" level=warning msg="Request Failed" error="Get \"http://host.docker.internal:8000/api/resources?all=true&status=approved\": request timeout"

running (3m32.0s), 20/20 VUs, 147 complete and 0 interrupted iterations
default   [  71% ] 20 VUs  3m32.0s/5m0s
time="2026-02-26T05:33:48Z" level=warning msg="Request Failed" error="Get \"http://host.docker.internal:8000/api/resources?all=true&status=approved\": request timeout"

running (3m33.0s), 20/20 VUs, 149 complete and 0 interrupted iterations
default   [  71% ] 20 VUs  3m33.0s/5m0s

running (3m34.0s), 20/20 VUs, 150 complete and 0 interrupted iterations
default   [  71% ] 20 VUs  3m34.0s/5m0s
time="2026-02-26T05:33:50Z" level=warning msg="Request Failed" error="Get \"http://host.docker.internal:8000/api/resources?all=true&status=approved\": request timeout"

running (3m35.0s), 20/20 VUs, 152 complete and 0 interrupted iterations
default   [  72% ] 20 VUs  3m35.0s/5m0s

running (3m36.0s), 20/20 VUs, 154 complete and 0 interrupted iterations
default   [  72% ] 20 VUs  3m36.0s/5m0s

running (3m37.0s), 20/20 VUs, 155 complete and 0 interrupted iterations
default   [  72% ] 20 VUs  3m37.0s/5m0s

running (3m38.0s), 20/20 VUs, 155 complete and 0 interrupted iterations
default   [  73% ] 20 VUs  3m38.0s/5m0s

running (3m39.0s), 20/20 VUs, 156 complete and 0 interrupted iterations
default   [  73% ] 20 VUs  3m39.0s/5m0s

running (3m40.0s), 20/20 VUs, 156 complete and 0 interrupted iterations
default   [  73% ] 20 VUs  3m40.0s/5m0s

running (3m41.0s), 20/20 VUs, 156 complete and 0 interrupted iterations
default   [  74% ] 20 VUs  3m41.0s/5m0s

running (3m42.0s), 20/20 VUs, 156 complete and 0 interrupted iterations
default   [  74% ] 20 VUs  3m42.0s/5m0s

running (3m43.0s), 20/20 VUs, 156 complete and 0 interrupted iterations
default   [  74% ] 20 VUs  3m43.0s/5m0s

running (3m44.0s), 20/20 VUs, 156 complete and 0 interrupted iterations
default   [  75% ] 20 VUs  3m44.0s/5m0s

running (3m45.0s), 20/20 VUs, 156 complete and 0 interrupted iterations
default   [  75% ] 20 VUs  3m45.0s/5m0s

running (3m46.0s), 20/20 VUs, 156 complete and 0 interrupted iterations
default   [  75% ] 20 VUs  3m46.0s/5m0s

running (3m47.0s), 20/20 VUs, 156 complete and 0 interrupted iterations
default   [  76% ] 20 VUs  3m47.0s/5m0s

running (3m48.0s), 20/20 VUs, 156 complete and 0 interrupted iterations
default   [  76% ] 20 VUs  3m48.0s/5m0s

running (3m49.0s), 20/20 VUs, 156 complete and 0 interrupted iterations
default   [  76% ] 20 VUs  3m49.0s/5m0s

running (3m50.0s), 20/20 VUs, 156 complete and 0 interrupted iterations
default   [  77% ] 20 VUs  3m50.0s/5m0s

running (3m51.0s), 20/20 VUs, 156 complete and 0 interrupted iterations
default   [  77% ] 20 VUs  3m51.0s/5m0s

running (3m52.0s), 20/20 VUs, 156 complete and 0 interrupted iterations
default   [  77% ] 20 VUs  3m52.0s/5m0s

running (3m53.0s), 20/20 VUs, 156 complete and 0 interrupted iterations
default   [  78% ] 20 VUs  3m53.0s/5m0s

running (3m54.0s), 20/20 VUs, 156 complete and 0 interrupted iterations
default   [  78% ] 20 VUs  3m54.0s/5m0s

running (3m55.0s), 20/20 VUs, 156 complete and 0 interrupted iterations
default   [  78% ] 20 VUs  3m55.0s/5m0s

running (3m56.0s), 20/20 VUs, 156 complete and 0 interrupted iterations
default   [  79% ] 20 VUs  3m56.0s/5m0s

running (3m57.0s), 20/20 VUs, 156 complete and 0 interrupted iterations
default   [  79% ] 20 VUs  3m57.0s/5m0s

running (3m58.0s), 20/20 VUs, 156 complete and 0 interrupted iterations
default   [  79% ] 20 VUs  3m58.0s/5m0s

running (3m59.0s), 20/20 VUs, 156 complete and 0 interrupted iterations
default   [  80% ] 20 VUs  3m59.0s/5m0s

running (4m00.0s), 20/20 VUs, 156 complete and 0 interrupted iterations
default   [  80% ] 20 VUs  4m00.0s/5m0s

running (4m01.0s), 20/20 VUs, 156 complete and 0 interrupted iterations
default   [  80% ] 20 VUs  4m01.0s/5m0s

running (4m02.0s), 20/20 VUs, 156 complete and 0 interrupted iterations
default   [  81% ] 20 VUs  4m02.0s/5m0s

running (4m03.0s), 20/20 VUs, 156 complete and 0 interrupted iterations
default   [  81% ] 20 VUs  4m03.0s/5m0s

running (4m04.0s), 20/20 VUs, 156 complete and 0 interrupted iterations
default   [  81% ] 20 VUs  4m04.0s/5m0s

running (4m05.0s), 20/20 VUs, 156 complete and 0 interrupted iterations
default   [  82% ] 20 VUs  4m05.0s/5m0s

running (4m06.0s), 20/20 VUs, 158 complete and 0 interrupted iterations
default   [  82% ] 20 VUs  4m06.0s/5m0s

running (4m07.0s), 20/20 VUs, 160 complete and 0 interrupted iterations
default   [  82% ] 20 VUs  4m07.0s/5m0s

running (4m08.0s), 20/20 VUs, 163 complete and 0 interrupted iterations
default   [  83% ] 20 VUs  4m08.0s/5m0s

running (4m09.0s), 20/20 VUs, 164 complete and 0 interrupted iterations
default   [  83% ] 20 VUs  4m09.0s/5m0s

running (4m10.0s), 20/20 VUs, 166 complete and 0 interrupted iterations
default   [  83% ] 20 VUs  4m10.0s/5m0s

running (4m11.0s), 20/20 VUs, 168 complete and 0 interrupted iterations
default   [  84% ] 20 VUs  4m11.0s/5m0s

running (4m12.0s), 20/20 VUs, 170 complete and 0 interrupted iterations
default   [  84% ] 20 VUs  4m12.0s/5m0s

running (4m13.0s), 20/20 VUs, 173 complete and 0 interrupted iterations
default   [  84% ] 20 VUs  4m13.0s/5m0s

running (4m14.0s), 20/20 VUs, 174 complete and 0 interrupted iterations
default   [  85% ] 20 VUs  4m14.0s/5m0s

running (4m15.0s), 20/20 VUs, 175 complete and 0 interrupted iterations
default   [  85% ] 20 VUs  4m15.0s/5m0s

running (4m16.0s), 20/20 VUs, 179 complete and 0 interrupted iterations
default   [  85% ] 20 VUs  4m16.0s/5m0s

running (4m17.0s), 20/20 VUs, 179 complete and 0 interrupted iterations
default   [  86% ] 20 VUs  4m17.0s/5m0s

running (4m18.0s), 20/20 VUs, 182 complete and 0 interrupted iterations
default   [  86% ] 20 VUs  4m18.0s/5m0s

running (4m19.0s), 20/20 VUs, 184 complete and 0 interrupted iterations
default   [  86% ] 20 VUs  4m19.0s/5m0s

running (4m20.0s), 20/20 VUs, 186 complete and 0 interrupted iterations
default   [  87% ] 20 VUs  4m20.0s/5m0s

running (4m21.0s), 20/20 VUs, 187 complete and 0 interrupted iterations
default   [  87% ] 20 VUs  4m21.0s/5m0s

running (4m22.0s), 20/20 VUs, 188 complete and 0 interrupted iterations
default   [  87% ] 20 VUs  4m22.0s/5m0s

running (4m23.0s), 20/20 VUs, 188 complete and 0 interrupted iterations
default   [  88% ] 20 VUs  4m23.0s/5m0s

running (4m24.0s), 20/20 VUs, 189 complete and 0 interrupted iterations
default   [  88% ] 20 VUs  4m24.0s/5m0s

running (4m25.0s), 20/20 VUs, 190 complete and 0 interrupted iterations
default   [  88% ] 20 VUs  4m25.0s/5m0s

running (4m26.0s), 20/20 VUs, 192 complete and 0 interrupted iterations
default   [  89% ] 20 VUs  4m26.0s/5m0s

running (4m27.0s), 20/20 VUs, 193 complete and 0 interrupted iterations
default   [  89% ] 20 VUs  4m27.0s/5m0s

running (4m28.0s), 20/20 VUs, 193 complete and 0 interrupted iterations
default   [  89% ] 20 VUs  4m28.0s/5m0s

running (4m29.0s), 20/20 VUs, 193 complete and 0 interrupted iterations
default   [  90% ] 20 VUs  4m29.0s/5m0s

running (4m30.0s), 20/20 VUs, 193 complete and 0 interrupted iterations
default   [  90% ] 20 VUs  4m30.0s/5m0s

running (4m31.0s), 20/20 VUs, 193 complete and 0 interrupted iterations
default   [  90% ] 20 VUs  4m31.0s/5m0s

running (4m32.0s), 20/20 VUs, 193 complete and 0 interrupted iterations
default   [  91% ] 20 VUs  4m32.0s/5m0s

running (4m33.0s), 20/20 VUs, 193 complete and 0 interrupted iterations
default   [  91% ] 20 VUs  4m33.0s/5m0s

running (4m34.0s), 20/20 VUs, 193 complete and 0 interrupted iterations
default   [  91% ] 20 VUs  4m34.0s/5m0s

running (4m35.0s), 20/20 VUs, 193 complete and 0 interrupted iterations
default   [  92% ] 20 VUs  4m35.0s/5m0s

running (4m36.0s), 20/20 VUs, 193 complete and 0 interrupted iterations
default   [  92% ] 20 VUs  4m36.0s/5m0s

running (4m37.0s), 20/20 VUs, 193 complete and 0 interrupted iterations
default   [  92% ] 20 VUs  4m37.0s/5m0s

running (4m38.0s), 20/20 VUs, 193 complete and 0 interrupted iterations
default   [  93% ] 20 VUs  4m38.0s/5m0s
time="2026-02-26T05:34:54Z" level=warning msg="Request Failed" error="Get \"http://host.docker.internal:8000/api/resources?all=true&status=approved\": request timeout"

running (4m39.0s), 20/20 VUs, 194 complete and 0 interrupted iterations
default   [  93% ] 20 VUs  4m39.0s/5m0s

running (4m40.0s), 20/20 VUs, 194 complete and 0 interrupted iterations
default   [  93% ] 20 VUs  4m40.0s/5m0s

running (4m41.0s), 20/20 VUs, 194 complete and 0 interrupted iterations
default   [  94% ] 20 VUs  4m41.0s/5m0s

running (4m42.0s), 20/20 VUs, 194 complete and 0 interrupted iterations
default   [  94% ] 20 VUs  4m42.0s/5m0s

running (4m43.0s), 20/20 VUs, 194 complete and 0 interrupted iterations
default   [  94% ] 20 VUs  4m43.0s/5m0s

running (4m44.0s), 20/20 VUs, 194 complete and 0 interrupted iterations
default   [  95% ] 20 VUs  4m44.0s/5m0s

running (4m45.0s), 20/20 VUs, 194 complete and 0 interrupted iterations
default   [  95% ] 20 VUs  4m45.0s/5m0s

running (4m46.0s), 20/20 VUs, 194 complete and 0 interrupted iterations
default   [  95% ] 20 VUs  4m46.0s/5m0s

running (4m47.0s), 20/20 VUs, 194 complete and 0 interrupted iterations
default   [  96% ] 20 VUs  4m47.0s/5m0s

running (4m48.0s), 20/20 VUs, 194 complete and 0 interrupted iterations
default   [  96% ] 20 VUs  4m48.0s/5m0s

running (4m49.0s), 20/20 VUs, 194 complete and 0 interrupted iterations
default   [  96% ] 20 VUs  4m49.0s/5m0s

running (4m50.0s), 20/20 VUs, 194 complete and 0 interrupted iterations
default   [  97% ] 20 VUs  4m50.0s/5m0s

running (4m51.0s), 20/20 VUs, 194 complete and 0 interrupted iterations
default   [  97% ] 20 VUs  4m51.0s/5m0s

running (4m52.0s), 20/20 VUs, 194 complete and 0 interrupted iterations
default   [  97% ] 20 VUs  4m52.0s/5m0s

running (4m53.0s), 20/20 VUs, 194 complete and 0 interrupted iterations
default   [  98% ] 20 VUs  4m53.0s/5m0s

running (4m54.0s), 20/20 VUs, 194 complete and 0 interrupted iterations
default   [  98% ] 20 VUs  4m54.0s/5m0s

running (4m55.0s), 20/20 VUs, 196 complete and 0 interrupted iterations
default   [  98% ] 20 VUs  4m55.0s/5m0s

running (4m56.0s), 20/20 VUs, 198 complete and 0 interrupted iterations
default   [  99% ] 20 VUs  4m56.0s/5m0s

running (4m57.0s), 20/20 VUs, 199 complete and 0 interrupted iterations
default   [  99% ] 20 VUs  4m57.0s/5m0s

running (4m58.0s), 20/20 VUs, 202 complete and 0 interrupted iterations
default   [  99% ] 20 VUs  4m58.0s/5m0s

running (4m59.0s), 20/20 VUs, 203 complete and 0 interrupted iterations
default   [ 100% ] 20 VUs  4m59.0s/5m0s

running (5m00.0s), 20/20 VUs, 207 complete and 0 interrupted iterations
default   [ 100% ] 20 VUs  5m00.0s/5m0s

running (5m01.0s), 18/20 VUs, 209 complete and 0 interrupted iterations
default ↓ [ 100% ] 20 VUs  5m0s

running (5m02.0s), 16/20 VUs, 211 complete and 0 interrupted iterations
default ↓ [ 100% ] 20 VUs  5m0s

running (5m03.0s), 14/20 VUs, 213 complete and 0 interrupted iterations
default ↓ [ 100% ] 20 VUs  5m0s

running (5m04.0s), 13/20 VUs, 214 complete and 0 interrupted iterations
default ↓ [ 100% ] 20 VUs  5m0s

running (5m05.0s), 11/20 VUs, 216 complete and 0 interrupted iterations
default ↓ [ 100% ] 20 VUs  5m0s

running (5m06.0s), 09/20 VUs, 218 complete and 0 interrupted iterations
default ↓ [ 100% ] 20 VUs  5m0s

running (5m07.0s), 09/20 VUs, 218 complete and 0 interrupted iterations
default ↓ [ 100% ] 20 VUs  5m0s

running (5m08.0s), 08/20 VUs, 219 complete and 0 interrupted iterations
default ↓ [ 100% ] 20 VUs  5m0s

running (5m09.0s), 08/20 VUs, 219 complete and 0 interrupted iterations
default ↓ [ 100% ] 20 VUs  5m0s

running (5m10.0s), 08/20 VUs, 219 complete and 0 interrupted iterations
default ↓ [ 100% ] 20 VUs  5m0s

running (5m11.0s), 08/20 VUs, 219 complete and 0 interrupted iterations
default ↓ [ 100% ] 20 VUs  5m0s

running (5m12.0s), 08/20 VUs, 219 complete and 0 interrupted iterations
default ↓ [ 100% ] 20 VUs  5m0s

running (5m13.0s), 08/20 VUs, 219 complete and 0 interrupted iterations
default ↓ [ 100% ] 20 VUs  5m0s

running (5m14.0s), 08/20 VUs, 219 complete and 0 interrupted iterations
default ↓ [ 100% ] 20 VUs  5m0s

running (5m15.0s), 08/20 VUs, 219 complete and 0 interrupted iterations
default ↓ [ 100% ] 20 VUs  5m0s

running (5m16.0s), 08/20 VUs, 219 complete and 0 interrupted iterations
default ↓ [ 100% ] 20 VUs  5m0s

running (5m17.0s), 08/20 VUs, 219 complete and 0 interrupted iterations
default ↓ [ 100% ] 20 VUs  5m0s

running (5m18.0s), 08/20 VUs, 219 complete and 0 interrupted iterations
default ↓ [ 100% ] 20 VUs  5m0s

running (5m19.0s), 08/20 VUs, 219 complete and 0 interrupted iterations
default ↓ [ 100% ] 20 VUs  5m0s

running (5m20.0s), 08/20 VUs, 219 complete and 0 interrupted iterations
default ↓ [ 100% ] 20 VUs  5m0s

running (5m21.0s), 07/20 VUs, 220 complete and 0 interrupted iterations
default ↓ [ 100% ] 20 VUs  5m0s

running (5m22.0s), 05/20 VUs, 222 complete and 0 interrupted iterations
default ↓ [ 100% ] 20 VUs  5m0s


  █ THRESHOLDS 

    http_req_duration
    ✗ 'p(95)<500' p(95)=1m0s

    http_req_failed
    ✗ 'rate<0.01' rate=16.74%


  █ TOTAL RESULTS 

    checks_total.......: 227    0.703673/s
    checks_succeeded...: 83.25% 189 out of 227
    checks_failed......: 16.74% 38 out of 227

    ✗ status 200
      ↳  83% — ✓ 189 / ✗ 38

    CUSTOM
    err_all........................: 16.74% 38 out of 227
    lat_graph......................: avg=9862.033187  med=3586.524838  p(90)=30143.959973 p(95)=30355.066467 p(99)=30754.919524 max=30784.17885 
    lat_list.......................: avg=47733.744931 med=49240.365488 p(90)=60000.444164 p(95)=60000.714367 p(99)=60001.035947 max=60001.741964
    lat_preview....................: avg=9929.97602   med=3316.621982  p(90)=30125.785386 p(95)=30390.233337 p(99)=30601.791698 max=30654.681288
    lat_semantic...................: avg=8150.619006  med=4804.631202  p(90)=30067.670562 p(95)=30205.015888 p(99)=30620.144486 max=30705.40651 

    HTTP
    http_req_duration..............: avg=27.17s       med=30.06s       p(90)=53.81s       p(95)=1m0s         p(99)=1m0s         max=1m0s        
      { expected_response:true }...: avg=24.34s       med=11.44s       p(90)=50.56s       p(95)=53.46s       p(99)=59.84s       max=59.92s      
    http_req_failed................: 16.74% 38 out of 227
    http_reqs......................: 227    0.703673/s

    EXECUTION
    iteration_duration.............: avg=27.37s       med=30.19s       p(90)=54.26s       p(95)=1m0s         p(99)=1m0s         max=1m0s        
    iterations.....................: 227    0.703673/s
    vus............................: 5      min=5         max=20
    vus_max........................: 20     min=20        max=20

    NETWORK
    data_received..................: 717 MB 2.2 MB/s
    data_sent......................: 71 kB  220 B/s




running (5m22.6s), 00/20 VUs, 227 complete and 0 interrupted iterations
default ✓ [ 100% ] 20 VUs  5m0s
time="2026-02-26T05:35:39Z" level=error msg="thresholds on metrics 'http_req_duration, http_req_failed' have been crossed"
